{
  "$schema": "../schemas/vertical.schema.json",
  "schema_version": "1.0.0",
  "name": "icu_vertical",
  "vertical": "icu",
  "seed": 0,
  "dataset": {
    "id": "synthetic_icu",
    "origin": "SYNTHETIC",
    "model": "SyntheticPhysiology",
    "modality": "telemetry",
    "channel": "oxygen_saturation",
    "unit": "1",
    "time_unit": "s",
    "duration_s": 12.0,
    "sample_rate_hz": 1,
    "sample_interval_s": 1.0
  },
  "task": {
    "id": "icu_threshold",
    "kind": "threshold_exceedance",
    "target": "oxygen_saturation",
    "horizon_s": 0.0,
    "metric": "task_law_discrepancy",
    "threshold": 0.979,
    "threshold_unit": "1",
    "loss": "zero_one",
    "reference": "full_information",
    "missingness": "unavailable",
    "uncertainty": "observed_availability"
  },
  "representation": {
    "name": "finite_history",
    "window": 5,
    "window_unit": "samples",
    "pad_value": 0.0
  },
  "perturbations": [
    {
      "type": "physiological_action",
      "time_s": 4.0,
      "kind": "hemorrhage",
      "parameters": {"hemorrhage_ml_min": 120.0}
    }
  ],
  "channel": {
    "model": "erasure",
    "loss_probability": 0.2,
    "latency_s": 0.02,
    "jitter_s": 0.005,
    "packet_payload_bytes": 256,
    "encoding": "float32_be",
    "deadline_s": 1.0,
    "semantic_permutation": false
  },
  "resource": {
    "model": "capacitor_p1",
    "capacitance_f": 0.2,
    "esr_ohm": 8.0,
    "leakage_siemens": 0.0,
    "initial_voltage_v": 2.65,
    "v_min": 1.85,
    "v_max": 3.3,
    "max_current_a": 0.02,
    "load_current_a": 0.001,
    "step_duration_s": 0.0001
  },
  "compute": {
    "location": "local",
    "operations_per_sample": 100.0,
    "operations_per_second": 100000.0,
    "memory_bytes": 4096,
    "required_memory_bytes": 64,
    "energy_per_operation_j": 1e-09,
    "network_latency_s": 0.0
  },
  "policy": {
    "class": "declared_threshold_policy",
    "thresholds": [0.978, 0.979, 0.98],
    "threshold_unit": "1",
    "information_set": "received_history",
    "action_set": ["negative", "positive", "abstain"],
    "fallback_action": "abstain",
    "rewards": {
      "true_positive": 1.0,
      "false_positive": -1.0,
      "true_negative": 1.0,
      "false_negative": -1.0,
      "unavailable": 0.0
    },
    "support_direction": [1.0, 0.0]
  },
  "split": {"strategy": "synthetic_fixed"},
  "metrics": [
    "packet_delivery",
    "available_fraction",
    "task_law_discrepancy",
    "task_value",
    "capability_support",
    "energy_j",
    "terminal_voltage_v",
    "compute_latency_s"
  ],
  "outputs": {"format": "json"}
}
